{
  "id": "song_what_child_is_this",
  "name": "What Child is This",
  "category": "christmas_songs",
  "type": "song",
  "difficulty": "intermediate",
  "tags": [
    "imported",
    "musicxml"
  ],
  "defaultKey": "C",
  "allowedKeys": [
    "C",
    "D",
    "E",
    "F",
    "G",
    "A",
    "B"
  ],
  "defaultTempoBpm": 90,
  "tempoRange": {
    "min": 30,
    "max": 240
  },
  "defaultOctave": 4,
  "allowedOctaves": [
    2,
    3,
    4,
    5
  ],
  "timeSig": {
    "beats": 3,
    "beatType": 4
  },
  "measures": [
    {
      "index": 0,
      "beats": 3,
      "notes": [
        {
          "type": "rest",
          "durationBeats": 2
        },
        {
          "type": "note",
          "pitch": "A4",
          "midi": 69,
          "degree": "La",
          "durationBeats": 1,
          "lyric": "What"
        }
      ],
      "chords": []
    },
    {
      "index": 1,
      "beats": 3,
      "notes": [
        {
          "type": "note",
          "pitch": "C5",
          "midi": 72,
          "degree": "Do",
          "durationBeats": 2,
          "lyric": "child"
        },
        {
          "type": "note",
          "pitch": "D5",
          "midi": 74,
          "degree": "Re",
          "durationBeats": 1,
          "lyric": "is"
        }
      ],
      "chords": []
    },
    {
      "index": 2,
      "beats": 3,
      "notes": [
        {
          "type": "note",
          "pitch": "E5",
          "midi": 76,
          "degree": "Mi",
          "durationBeats": 1.5,
          "lyric": "thi"
        },
        {
          "type": "note",
          "pitch": "F5",
          "midi": 77,
          "degree": "Fa",
          "durationBeats": 0.5,
          "lyric": "-is"
        },
        {
          "type": "note",
          "pitch": "E5",
          "midi": 76,
          "degree": "Mi",
          "durationBeats": 1,
          "lyric": "who"
        }
      ],
      "chords": []
    },
    {
      "index": 3,
      "beats": 3,
      "notes": [
        {
          "type": "note",
          "pitch": "D5",
          "midi": 74,
          "degree": "Re",
          "durationBeats": 2,
          "lyric": "laid"
        },
        {
          "type": "note",
          "pitch": "B4",
          "midi": 71,
          "degree": "Ti",
          "durationBeats": 1,
          "lyric": "to"
        }
      ],
      "chords": []
    },
    {
      "index": 4,
      "beats": 3,
      "notes": [
        {
          "type": "note",
          "pitch": "G4",
          "midi": 67,
          "degree": "Sol",
          "durationBeats": 1.5,
          "lyric": "re"
        },
        {
          "type": "note",
          "pitch": "A4",
          "midi": 69,
          "degree": "La",
          "durationBeats": 0.5,
          "lyric": "-est"
        },
        {
          "type": "note",
          "pitch": "B4",
          "midi": 71,
          "degree": "Ti",
          "durationBeats": 1,
          "lyric": "on"
        }
      ],
      "chords": []
    },
    {
      "index": 5,
      "beats": 3,
      "notes": [
        {
          "type": "note",
          "pitch": "A4",
          "midi": 69,
          "degree": "La",
          "durationBeats": 2,
          "lyric": "Ma"
        },
        {
          "type": "note",
          "pitch": "A4",
          "midi": 69,
          "degree": "La",
          "durationBeats": 1,
          "lyric": "-rys"
        }
      ],
      "chords": []
    },
    {
      "index": 6,
      "beats": 3,
      "notes": [
        {
          "type": "note",
          "pitch": "A4",
          "midi": 69,
          "degree": "La",
          "durationBeats": 1.5,
          "lyric": "lap"
        },
        {
          "type": "note",
          "pitch": "G#4",
          "midi": 68,
          "degree": "La",
          "durationBeats": 0.5,
          "lyric": "is"
        },
        {
          "type": "note",
          "pitch": "A4",
          "midi": 69,
          "degree": "La",
          "durationBeats": 1,
          "lyric": "sleep"
        }
      ],
      "chords": []
    },
    {
      "index": 7,
      "beats": 3,
      "notes": [
        {
          "type": "note",
          "pitch": "B4",
          "midi": 71,
          "degree": "Ti",
          "durationBeats": 3,
          "lyric": "sleep"
        }
      ],
      "chords": []
    },
    {
      "index": 8,
      "beats": 3,
      "notes": [
        {
          "type": "note",
          "pitch": "E4",
          "midi": 64,
          "degree": "Mi",
          "durationBeats": 2,
          "lyric": "ing"
        },
        {
          "type": "note",
          "pitch": "A4",
          "midi": 69,
          "degree": "La",
          "durationBeats": 1,
          "lyric": "Whom"
        }
      ],
      "chords": []
    },
    {
      "index": 9,
      "beats": 3,
      "notes": [
        {
          "type": "note",
          "pitch": "C5",
          "midi": 72,
          "degree": "Do",
          "durationBeats": 2,
          "lyric": "an"
        },
        {
          "type": "note",
          "pitch": "D5",
          "midi": 74,
          "degree": "Re",
          "durationBeats": 1,
          "lyric": "gels"
        }
      ],
      "chords": []
    },
    {
      "index": 10,
      "beats": 3,
      "notes": [
        {
          "type": "note",
          "pitch": "E5",
          "midi": 76,
          "degree": "Mi",
          "durationBeats": 1.5,
          "lyric": "gree"
        },
        {
          "type": "note",
          "pitch": "F5",
          "midi": 77,
          "degree": "Fa",
          "durationBeats": 0.5,
          "lyric": "eet"
        },
        {
          "type": "note",
          "pitch": "E5",
          "midi": 76,
          "degree": "Mi",
          "durationBeats": 1,
          "lyric": "with"
        }
      ],
      "chords": []
    },
    {
      "index": 11,
      "beats": 3,
      "notes": [
        {
          "type": "note",
          "pitch": "D5",
          "midi": 74,
          "degree": "Re",
          "durationBeats": 2,
          "lyric": "an"
        },
        {
          "type": "note",
          "pitch": "B4",
          "midi": 71,
          "degree": "Ti",
          "durationBeats": 1,
          "lyric": "thems"
        }
      ],
      "chords": []
    },
    {
      "index": 12,
      "beats": 3,
      "notes": [
        {
          "type": "note",
          "pitch": "G4",
          "midi": 67,
          "degree": "Sol",
          "durationBeats": 1.5,
          "lyric": "swe"
        },
        {
          "type": "note",
          "pitch": "A4",
          "midi": 69,
          "degree": "La",
          "durationBeats": 0.5,
          "lyric": "et"
        },
        {
          "type": "note",
          "pitch": "B4",
          "midi": 71,
          "degree": "Ti",
          "durationBeats": 1,
          "lyric": "while"
        }
      ],
      "chords": []
    },
    {
      "index": 13,
      "beats": 3,
      "notes": [
        {
          "type": "note",
          "pitch": "C5",
          "midi": 72,
          "degree": "Do",
          "durationBeats": 1.5,
          "lyric": "shep"
        },
        {
          "type": "note",
          "pitch": "B4",
          "midi": 71,
          "degree": "Ti",
          "durationBeats": 0.5,
          "lyric": "he"
        },
        {
          "type": "note",
          "pitch": "A4",
          "midi": 69,
          "degree": "La",
          "durationBeats": 1,
          "lyric": "erds"
        }
      ],
      "chords": []
    },
    {
      "index": 14,
      "beats": 3,
      "notes": [
        {
          "type": "note",
          "pitch": "G#4",
          "midi": 68,
          "degree": "La",
          "durationBeats": 1.5,
          "lyric": "waa"
        },
        {
          "type": "note",
          "pitch": "F#4",
          "midi": 66,
          "degree": "Sol",
          "durationBeats": 0.5,
          "lyric": "atch"
        },
        {
          "type": "note",
          "pitch": "G4",
          "midi": 67,
          "degree": "Sol",
          "durationBeats": 1,
          "lyric": "are"
        }
      ],
      "chords": []
    },
    {
      "index": 15,
      "beats": 3,
      "notes": [
        {
          "type": "note",
          "pitch": "A4",
          "midi": 69,
          "degree": "La",
          "durationBeats": 3,
          "lyric": "keep"
        }
      ],
      "chords": []
    },
    {
      "index": 16,
      "beats": 3,
      "notes": [
        {
          "type": "note",
          "pitch": "A4",
          "midi": 69,
          "degree": "La",
          "durationBeats": 3,
          "lyric": "ing"
        }
      ],
      "chords": []
    }
  ],
  "source": {
    "kind": "preloaded",
    "version": "1.0.0"
  },
  "updatedAt": "2026-03-09T02:28:27.426Z"
}