{
  "id": "song_jingle_bells_excerpt",
  "name": "Jingle Bells (Excerpt)",
  "category": "christmas_songs",
  "type": "song",
  "difficulty": "beginner",
  "tags": ["christmas", "public_domain", "folk"],
  "defaultKey": "C",
  "allowedKeys": ["C", "D", "F", "G"],
  "defaultTempoBpm": 60,
  "tempoRange": { "min": 30, "max": 140 },
  "defaultChunkSize": 5,
  "chunkSizeRange": { "min": 3, "max": 8 },
  "defaultOctave": 4,
  "allowedOctaves": [2, 3, 4, 5],
  "notes": [
    { "type": "note", "pitch": "E4", "midi": 64, "degree": "Mi", "durationBeats": 1 },
    { "type": "note", "pitch": "E4", "midi": 64, "degree": "Mi", "durationBeats": 1 },
    { "type": "note", "pitch": "E4", "midi": 64, "degree": "Mi", "durationBeats": 2 },
    { "type": "note", "pitch": "E4", "midi": 64, "degree": "Mi", "durationBeats": 1 },
    { "type": "note", "pitch": "E4", "midi": 64, "degree": "Mi", "durationBeats": 1 },
    { "type": "note", "pitch": "E4", "midi": 64, "degree": "Mi", "durationBeats": 2 },
    { "type": "note", "pitch": "E4", "midi": 64, "degree": "Mi", "durationBeats": 1 },
    { "type": "rest", "durationBeats": 1 },
    { "type": "note", "pitch": "G4", "midi": 67, "degree": "Sol", "durationBeats": 1 },
    { "type": "note", "pitch": "C4", "midi": 60, "degree": "Do", "durationBeats": 1 },
    { "type": "note", "pitch": "D4", "midi": 62, "degree": "Re", "durationBeats": 1 },
    { "type": "note", "pitch": "E4", "midi": 64, "degree": "Mi", "durationBeats": 4 }
  ],
  "phrases": [
    { "startNoteIndex": 0, "endNoteIndex": 6, "label": "Jingle phrase A" },
    { "startNoteIndex": 8, "endNoteIndex": 11, "label": "Jingle phrase B" }
  ],
  "source": { "kind": "preloaded", "version": "1.0.0" },
  "updatedAt": "2026-02-16T00:00:00Z"
}
