{
  "id": "song",
  "name": "In the pines",
  "category": "folk_songs",
  "type": "song",
  "difficulty": "beginner",
  "tags": [],
  "defaultKey": "D",
  "allowedKeys": [
    "C",
    "D",
    "E",
    "F",
    "G",
    "A",
    "Bb"
  ],
  "defaultTempoBpm": 90,
  "tempoRange": {
    "min": 30,
    "max": 240
  },
  "defaultOctave": 4,
  "allowedOctaves": [
    2,
    3,
    4,
    5
  ],
  "timeSig": {
    "beats": 3,
    "beatType": 4
  },
  "measures": [
    {
      "index": 0,
      "beats": 3,
      "notes": [
        {
          "type": "rest",
          "durationBeats": 2
        },
        {
          "type": "note",
          "pitch": "F#4",
          "midi": 66,
          "degree": "Mi",
          "durationBeats": 0.5,
          "lyric": "In"
        },
        {
          "type": "note",
          "pitch": "E4",
          "midi": 64,
          "degree": "Re",
          "durationBeats": 0.5,
          "lyric": "the"
        }
      ],
      "chords": []
    },
    {
      "index": 1,
      "beats": 3,
      "notes": [
        {
          "type": "note",
          "pitch": "D4",
          "midi": 62,
          "degree": "Do",
          "durationBeats": 1.5,
          "lyric": "pines"
        },
        {
          "type": "note",
          "pitch": "D4",
          "midi": 62,
          "degree": "Do",
          "durationBeats": 0.5,
          "lyric": "i-"
        },
        {
          "type": "note",
          "pitch": "D4",
          "midi": 62,
          "degree": "Do",
          "durationBeats": 0.5,
          "lyric": "in"
        },
        {
          "type": "note",
          "pitch": "F#4",
          "midi": 66,
          "degree": "Mi",
          "durationBeats": 0.5,
          "lyric": "the"
        }
      ],
      "chords": [
        {
          "beat": 1,
          "root": "D",
          "kind": "major"
        }
      ]
    },
    {
      "index": 2,
      "beats": 3,
      "notes": [
        {
          "type": "note",
          "pitch": "A4",
          "midi": 69,
          "degree": "Sol",
          "durationBeats": 1.5,
          "lyric": "pines"
        },
        {
          "type": "note",
          "pitch": "A4",
          "midi": 69,
          "degree": "Sol",
          "durationBeats": 0.5,
          "lyric": "whe-"
        },
        {
          "type": "note",
          "pitch": "A4",
          "midi": 69,
          "degree": "Sol",
          "durationBeats": 0.3333,
          "lyric": "e-"
        },
        {
          "type": "note",
          "pitch": "B4",
          "midi": 71,
          "degree": "La",
          "durationBeats": 0.3333,
          "lyric": "re"
        },
        {
          "type": "note",
          "pitch": "A4",
          "midi": 69,
          "degree": "Sol",
          "durationBeats": 0.3333,
          "lyric": "the"
        }
      ],
      "chords": [
        {
          "beat": 1,
          "root": "D",
          "kind": "major"
        }
      ]
    },
    {
      "index": 3,
      "beats": 3,
      "notes": [
        {
          "type": "note",
          "pitch": "G4",
          "midi": 67,
          "degree": "Fa",
          "durationBeats": 1.5,
          "lyric": "sun"
        },
        {
          "type": "note",
          "pitch": "G4",
          "midi": 67,
          "degree": "Fa",
          "durationBeats": 0.5,
          "lyric": "ne-"
        },
        {
          "type": "note",
          "pitch": "G4",
          "midi": 67,
          "degree": "Fa",
          "durationBeats": 0.5,
          "lyric": "e-"
        },
        {
          "type": "note",
          "pitch": "A4",
          "midi": 69,
          "degree": "Sol",
          "durationBeats": 0.5,
          "lyric": "ver"
        }
      ],
      "chords": [
        {
          "beat": 1,
          "root": "D",
          "kind": "major"
        }
      ]
    },
    {
      "index": 4,
      "beats": 3,
      "notes": [
        {
          "type": "note",
          "pitch": "F#4",
          "midi": 66,
          "degree": "Mi",
          "durationBeats": 2,
          "lyric": "shines"
        },
        {
          "type": "note",
          "pitch": "F#4",
          "midi": 66,
          "degree": "Mi",
          "durationBeats": 0.5,
          "lyric": "and"
        },
        {
          "type": "note",
          "pitch": "G4",
          "midi": 67,
          "degree": "Fa",
          "durationBeats": 0.5,
          "lyric": "you"
        }
      ],
      "chords": [
        {
          "beat": 1,
          "root": "G",
          "kind": "major"
        }
      ]
    },
    {
      "index": 5,
      "beats": 3,
      "notes": [
        {
          "type": "note",
          "pitch": "A4",
          "midi": 69,
          "degree": "Sol",
          "durationBeats": 0.5,
          "lyric": "shi-"
        },
        {
          "type": "note",
          "pitch": "A4",
          "midi": 69,
          "degree": "Sol",
          "durationBeats": 1,
          "lyric": "ver"
        },
        {
          "type": "note",
          "pitch": "A4",
          "midi": 69,
          "degree": "Sol",
          "durationBeats": 0.5,
          "lyric": "whe"
        },
        {
          "type": "note",
          "pitch": "F#4",
          "midi": 66,
          "degree": "Mi",
          "durationBeats": 0.3333,
          "lyric": "e"
        },
        {
          "type": "note",
          "pitch": "E4",
          "midi": 64,
          "degree": "Re",
          "durationBeats": 0.3333,
          "lyric": "en"
        },
        {
          "type": "note",
          "pitch": "D4",
          "midi": 62,
          "degree": "Do",
          "durationBeats": 0.3333,
          "lyric": "the"
        }
      ],
      "chords": [
        {
          "beat": 1,
          "root": "D",
          "kind": "major"
        }
      ]
    },
    {
      "index": 6,
      "beats": 3,
      "notes": [
        {
          "type": "note",
          "pitch": "E4",
          "midi": 64,
          "degree": "Re",
          "durationBeats": 1.5,
          "lyric": "cold"
        },
        {
          "type": "note",
          "pitch": "E4",
          "midi": 64,
          "degree": "Re",
          "durationBeats": 0.5,
          "lyric": "wi"
        },
        {
          "type": "note",
          "pitch": "E4",
          "midi": 64,
          "degree": "Re",
          "durationBeats": 0.3333,
          "lyric": "i"
        },
        {
          "type": "note",
          "pitch": "F#4",
          "midi": 66,
          "degree": "Mi",
          "durationBeats": 0.3333,
          "lyric": "i"
        },
        {
          "type": "note",
          "pitch": "E4",
          "midi": 64,
          "degree": "Re",
          "durationBeats": 0.3333,
          "lyric": "nd"
        }
      ],
      "chords": [
        {
          "beat": 1,
          "root": "A",
          "kind": "major"
        }
      ]
    },
    {
      "index": 7,
      "beats": 3,
      "notes": [
        {
          "type": "note",
          "pitch": "D4",
          "midi": 62,
          "degree": "Do",
          "durationBeats": 1.5,
          "lyric": "blows"
        },
        {
          "type": "rest",
          "durationBeats": 1.5
        }
      ],
      "chords": [
        {
          "beat": 1,
          "root": "D",
          "kind": "major"
        }
      ]
    }
  ],
  "source": {
    "kind": "preloaded",
    "version": "1.0.0"
  },
  "updatedAt": "2026-03-05T01:08:28.241Z"
}