{
  "id": "song_will_the_circle_be_unbroken",
  "name": "Will The Circle Be Unbroken",
  "category": "folk_songs",
  "type": "song",
  "difficulty": "intermediate",
  "tags": [
    "imported",
    "musicxml"
  ],
  "defaultKey": "D",
  "allowedKeys": [
    "C",
    "D",
    "E",
    "F",
    "G",
    "A",
    "B"
  ],
  "defaultTempoBpm": 90,
  "tempoRange": {
    "min": 30,
    "max": 240
  },
  "defaultOctave": 4,
  "allowedOctaves": [
    2,
    3,
    4,
    5
  ],
  "timeSig": {
    "beats": 4,
    "beatType": 4
  },
  "measures": [
    {
      "index": 0,
      "beats": 4,
      "notes": [
        {
          "type": "rest",
          "durationBeats": 2
        },
        {
          "type": "note",
          "pitch": "A3",
          "midi": 57,
          "degree": "Sol",
          "durationBeats": 1
        },
        {
          "type": "note",
          "pitch": "B3",
          "midi": 59,
          "degree": "La",
          "durationBeats": 1
        }
      ],
      "chords": []
    },
    {
      "index": 1,
      "beats": 4,
      "notes": [
        {
          "type": "note",
          "pitch": "D4",
          "midi": 62,
          "degree": "Do",
          "durationBeats": 2
        },
        {
          "type": "note",
          "pitch": "D4",
          "midi": 62,
          "degree": "Do",
          "durationBeats": 2
        }
      ],
      "chords": [
        {
          "beat": 1,
          "root": "D",
          "kind": "major"
        }
      ]
    },
    {
      "index": 2,
      "beats": 4,
      "notes": [
        {
          "type": "note",
          "pitch": "D4",
          "midi": 62,
          "degree": "Do",
          "durationBeats": 2
        },
        {
          "type": "note",
          "pitch": "F#4",
          "midi": 66,
          "degree": "Mi",
          "durationBeats": 1
        },
        {
          "type": "note",
          "pitch": "E4",
          "midi": 64,
          "degree": "Re",
          "durationBeats": 1
        }
      ],
      "chords": [
        {
          "beat": 1,
          "root": "D",
          "kind": "major"
        }
      ]
    },
    {
      "index": 3,
      "beats": 4,
      "notes": [
        {
          "type": "note",
          "pitch": "D4",
          "midi": 62,
          "degree": "Do",
          "durationBeats": 2
        },
        {
          "type": "note",
          "pitch": "F#4",
          "midi": 66,
          "degree": "Mi",
          "durationBeats": 2
        }
      ],
      "chords": [
        {
          "beat": 1,
          "root": "D",
          "kind": "major"
        }
      ]
    },
    {
      "index": 4,
      "beats": 4,
      "notes": [
        {
          "type": "note",
          "pitch": "F#4",
          "midi": 66,
          "degree": "Mi",
          "durationBeats": 2
        },
        {
          "type": "note",
          "pitch": "F#4",
          "midi": 66,
          "degree": "Mi",
          "durationBeats": 1
        },
        {
          "type": "note",
          "pitch": "E4",
          "midi": 64,
          "degree": "Re",
          "durationBeats": 1
        }
      ],
      "chords": [
        {
          "beat": 1,
          "root": "D",
          "kind": "major"
        }
      ]
    },
    {
      "index": 5,
      "beats": 4,
      "notes": [
        {
          "type": "note",
          "pitch": "D4",
          "midi": 62,
          "degree": "Do",
          "durationBeats": 3
        },
        {
          "type": "note",
          "pitch": "D4",
          "midi": 62,
          "degree": "Do",
          "durationBeats": 1
        }
      ],
      "chords": [
        {
          "beat": 1,
          "root": "G",
          "kind": "major"
        }
      ]
    },
    {
      "index": 6,
      "beats": 4,
      "notes": [
        {
          "type": "note",
          "pitch": "D4",
          "midi": 62,
          "degree": "Do",
          "durationBeats": 2
        },
        {
          "type": "note",
          "pitch": "B3",
          "midi": 59,
          "degree": "La",
          "durationBeats": 2
        }
      ],
      "chords": [
        {
          "beat": 1,
          "root": "G",
          "kind": "major"
        }
      ]
    },
    {
      "index": 7,
      "beats": 4,
      "notes": [
        {
          "type": "note",
          "pitch": "A3",
          "midi": 57,
          "degree": "Sol",
          "durationBeats": 4
        }
      ],
      "chords": [
        {
          "beat": 1,
          "root": "D",
          "kind": "major"
        }
      ]
    },
    {
      "index": 8,
      "beats": 4,
      "notes": [
        {
          "type": "rest",
          "durationBeats": 2
        },
        {
          "type": "note",
          "pitch": "A3",
          "midi": 57,
          "degree": "Sol",
          "durationBeats": 1
        },
        {
          "type": "note",
          "pitch": "B3",
          "midi": 59,
          "degree": "La",
          "durationBeats": 1
        }
      ],
      "chords": [
        {
          "beat": 1,
          "root": "D",
          "kind": "major"
        }
      ]
    },
    {
      "index": 9,
      "beats": 4,
      "notes": [
        {
          "type": "note",
          "pitch": "D4",
          "midi": 62,
          "degree": "Do",
          "durationBeats": 2
        },
        {
          "type": "note",
          "pitch": "D4",
          "midi": 62,
          "degree": "Do",
          "durationBeats": 2
        }
      ],
      "chords": [
        {
          "beat": 1,
          "root": "D",
          "kind": "major"
        }
      ]
    },
    {
      "index": 10,
      "beats": 4,
      "notes": [
        {
          "type": "note",
          "pitch": "D4",
          "midi": 62,
          "degree": "Do",
          "durationBeats": 2
        },
        {
          "type": "note",
          "pitch": "F#4",
          "midi": 66,
          "degree": "Mi",
          "durationBeats": 1
        },
        {
          "type": "note",
          "pitch": "A4",
          "midi": 69,
          "degree": "Sol",
          "durationBeats": 1
        }
      ],
      "chords": [
        {
          "beat": 1,
          "root": "D",
          "kind": "major"
        }
      ]
    },
    {
      "index": 11,
      "beats": 4,
      "notes": [
        {
          "type": "note",
          "pitch": "A4",
          "midi": 69,
          "degree": "Sol",
          "durationBeats": 2
        },
        {
          "type": "note",
          "pitch": "F#4",
          "midi": 66,
          "degree": "Mi",
          "durationBeats": 2
        }
      ],
      "chords": [
        {
          "beat": 1,
          "root": "D",
          "kind": "major"
        }
      ]
    },
    {
      "index": 12,
      "beats": 4,
      "notes": [
        {
          "type": "note",
          "pitch": "F#4",
          "midi": 66,
          "degree": "Mi",
          "durationBeats": 2
        },
        {
          "type": "note",
          "pitch": "D4",
          "midi": 62,
          "degree": "Do",
          "durationBeats": 1
        },
        {
          "type": "note",
          "pitch": "E4",
          "midi": 64,
          "degree": "Re",
          "durationBeats": 1
        }
      ],
      "chords": [
        {
          "beat": 1,
          "root": "B",
          "kind": "minor"
        }
      ]
    },
    {
      "index": 13,
      "beats": 4,
      "notes": [
        {
          "type": "note",
          "pitch": "F#4",
          "midi": 66,
          "degree": "Mi",
          "durationBeats": 2
        },
        {
          "type": "note",
          "pitch": "F#4",
          "midi": 66,
          "degree": "Mi",
          "durationBeats": 2
        }
      ],
      "chords": [
        {
          "beat": 1,
          "root": "D",
          "kind": "major"
        }
      ]
    },
    {
      "index": 14,
      "beats": 4,
      "notes": [
        {
          "type": "note",
          "pitch": "E4",
          "midi": 64,
          "degree": "Re",
          "durationBeats": 2
        },
        {
          "type": "note",
          "pitch": "F#4",
          "midi": 66,
          "degree": "Mi",
          "durationBeats": 1
        },
        {
          "type": "note",
          "pitch": "E4",
          "midi": 64,
          "degree": "Re",
          "durationBeats": 1
        }
      ],
      "chords": [
        {
          "beat": 3,
          "root": "A",
          "kind": "major"
        }
      ]
    },
    {
      "index": 15,
      "beats": 4,
      "notes": [
        {
          "type": "note",
          "pitch": "D4",
          "midi": 62,
          "degree": "Do",
          "durationBeats": 4
        }
      ],
      "chords": [
        {
          "beat": 1,
          "root": "D",
          "kind": "major"
        }
      ]
    }
  ],
  "source": {
    "kind": "preloaded",
    "version": "1.0.0"
  },
  "updatedAt": "2026-03-02T23:37:31.754Z"
}